NAME,VARID,ModuleNo,Module,SubModel,TYPE,TYPE NAME,ID2,Color,
SWINGSTS,969,11,Interstate,Interstate: Swing States,1,Variable,SWINGSTS:  Swing states and swingees,Azure,
tgrld,984,11,Agriculture,Agriculture: Production,1,Variable,tgrld:  Target growth in cultivated land,Red,
TGRYL,985,11,Agriculture,Agriculture: Production,1,Variable,TGRYL:  Target growth in agricultural yield,Red,
vehicflpcm,1011,11,Infrastructure,Infrastructure: Automobiles,2,Parameter,"vehicflpcm:  Vehicle fleet per capita, multiplier",Brown,
watres,1017,11,Water,Water: Resources,2,Parameter,"watres:  Water resources, renewable",cyan,
WATSAFE,1018,11,Infrastructure,Infrastructure: Safe Water,1,Variable,"WATSAFE:  Water source safe, percentage of people with access to",Brown,
WATSAFECOST,1019,11,Infrastructure,Infrastructure: Safe Water,1,Variable,"WATSAFECOST:  Infrastructure, water, cost of adding an improved connection to a household",Brown,
watsafecostm,1021,11,Infrastructure,Infrastructure: Safe Water,2,Parameter,"watsafecostm:  Infrastructure, water, multiplier on cost of adding an improved connection to a household",Brown,
WATSAFEDEM,1023,11,Infrastructure,Infrastructure: Safe Water,1,Variable,"WATSAFEDEM:  Water source safe, percentage of people with access to, demand",Brown,
WATSAFEIMPCOST,1026,11,Infrastructure,Infrastructure: Safe Water,1,Variable,"WATSAFEIMPCOST:  Infrastructure, water, cost of providing other improved sources, per person",Brown,
watsafeimpcostm,1028,11,Infrastructure,Infrastructure: Safe Water,2,Parameter,"watsafeimpcostm:  Infrastructure, water, multiplier on cost of adding other improve sources, per person",Brown,
watsafem,1032,11,Infrastructure,Infrastructure: Safe Water,2,Parameter,"watsafem:  Water source safe, percentage of people with access to, multiplier",Brown,
watsafenoconsetar,1033,11,Infrastructure,Infrastructure: Safe Water,2,Parameter,"watsafenoconsetar:  Infrastructure, safe water, no connection, strandard error target",Brown,
watsafenoconseyrtar,1034,11,Infrastructure,Infrastructure: Safe Water,2,Parameter,"watsafenoconseyrtar:  Infrastructure, safe water, no connection, years to target standard error",Brown,
watsafetrgtval,1035,11,Infrastructure,Infrastructure: Safe Water,2,Parameter,"watsafetrgtval:  Safe Water Access Target, value for fixed target, percent w/o access to safe water, works with watsafetrgtyr",Brown,
watsafetrgtyr,1036,11,Infrastructure,Infrastructure: Safe Water,2,Parameter,watsafetrgtyr:  Universal Safe Water Access Target Year (number of years from starting point),Brown,
watsafhldsw,1037,11,Infrastructure,Infrastructure: Safe Water,2,Parameter,watsafhldsw:  Safe Water hold switch,Brown,
WATUSE,1038,11,Water,Water: Use,1,Variable,"WATUSE:  Water usage, annual",cyan,
WATUSEPC,1039,11,Water,Water: Use,1,Variable,"WATUSEPC:  Water usage per capita, annual",cyan,
WATWASTE,1040,11,Water,Water: Waste,1,Variable,"WATWASTE:  Wastewater collection system, percentage of people connected to",cyan,
watwastem,1041,11,Water,Water: Waste,2,Parameter,"watwastem:  Wastewater collection system, percentage of people connected to, multiplier",cyan,
WATWASTETREAT,1042,11,Water,Water: Waste,1,Variable,"WATWASTETREAT:  Wastewater treatment, % of population connected to collection and treatment",cyan,
WATWASTETREATCOST,1043,11,Water,Water: Waste,1,Variable,"WATWASTETREATCOST:  Waster Water Treatment Cost, per person",cyan,
watwastetreatcostm,1045,11,Water,Water: Waste,2,Parameter,"watwastetreatcostm:  Wastewater treatment cost, per person, multiplier",cyan,
WATWASTETREATDEM,1047,11,Water,Water: Waste,1,Variable,"WATWASTETREATDEM:  Wastewater treatment, % of collection treated, demand",cyan,
watwastetreatlife,1048,11,Water,Water: Waste,2,Parameter,"watwastetreatlife:  Wastewater treatment facilities, lifetime",cyan,
watwastetreatm,1049,11,Water,Water: Waste,2,Parameter,"watwastetreatm:  Wastewater treatment, % of collection treated, multiplier",cyan,
watwastetreatsetar,1050,11,Water,Water: Waste,2,Parameter,"watwastetreatsetar:  Infrastructure, WasteWater, standard error target",cyan,
watwastetreatseyrtar,1051,11,Water,Water: Waste,2,Parameter,"watwastetreatseyrtar:  Infrastructure, WasteWater, years to target standard error",cyan,
HLCOST,1165,11,Health,Health: Health Cost and Expenditure,1,Variable,HLCOST:  Total Health Cost,Purple,
HLCOSTLE,1166,11,Health,Health: Health Cost and Expenditure,1,Variable,HLCOSTLE:  Life Extension Cost,Purple,
HLCOSTMORB,1167,11,Health,Health: Health Cost and Expenditure,1,Variable,HLCOSTMORB:  Morbidity Cost,Purple,
HLCOSTMORT,1168,11,Health,Health: Health Cost and Expenditure,1,Variable,HLCOSTMORT:  Mortality Cost,Purple,
HLCOSTOTHER,1169,11,Health,Health: Health Cost and Expenditure,1,Variable,HLCOSTOTHER:  Other Health Cost,Purple,
HLEXPEND,1170,11,Health,Health: Health Cost and Expenditure,1,Variable,HLEXPEND:  Total Heatlh Expenditures (Public and Private),Purple,
HLEXPENDPRIV,1171,11,Health,Health: Health Cost and Expenditure,1,Variable,HLEXPENDPRIV:  Private Heatlh Expenditures,Purple,
hlcostleyrper,1178,11,Health,Health: Health Cost and Expenditure,2,Parameter,hlcostleyrper:  Life Extension Treatment Cost per year person,Purple,
hlcostletime,1179,11,Health,Health: Health Cost and Expenditure,2,Parameter,hlcostletime:  Life Extension Treatment Duration,Purple,
HLCOSTLESUB,1180,11,Health,Health: Health Cost and Expenditure,1,Variable,HLCOSTLESUB:  Life Extension Cost Subsidy,Purple,
hlcostotherrattarget,1181,11,Health,Health: Health Cost and Expenditure,2,Parameter,"hlcostotherrattarget:  Health Cost other ratio to Mort, Morb and LE cost target",Purple,
hlcostotherrattargetconv,1182,11,Health,Health: Health Cost and Expenditure,2,Parameter,"hlcostotherrattargetconv:  Health Cost other ratio to Mort, Morb and LE cost target convergence",Purple,
WATDEMAND,1184,11,Water,Water: Demand,1,Variable,"WATDEMAND:  Water Demand by sector: Municipal, Industrial, Agriculture",cyan,
WASTEWATERSUPPLY,1185,11,Water,Water: Supply,1,Variable,"WASTEWATERSUPPLY:  Wastewater supply: Produced, Treated, Reused",cyan,
WATERDESALINATED,1186,11,Water,Water: Desalination,1,Variable,WATERDESALINATED:  Water Desalinated,cyan,
WATERRESFOSSIL,1187,11,Water,Water: Resources,1,Variable,WATERRESFOSSIL:  Reserves of fossil water,cyan,
WATERTOTALSUPPLY,1188,11,Water,Water: Supply,1,Variable,"WATERTOTALSUPPLY:  Total water supply: Surface, Ground, Fossil, Desalinated, Reused wastewater",cyan,
WATERWITHDRAWAL,1189,11,Water,Water: Withdrawal,1,Variable,"WATERWITHDRAWAL:  Water withdrawal: Surface, Ground, Fossil",cyan,
WATRESEXPLOITRENEW,1190,11,Water,Water: Resources,1,Variable,"WATRESEXPLOITRENEW:  Exploitable renewable freshwater resources: Surface, Ground",cyan,
wastewaterportiontreated,1192,11,Water,Water: Waste,2,Parameter,wastewaterportiontreated:  Portion of wastewater that is treated,cyan,
waterdesalinatedgr,1194,11,Water,Water: Desalination,2,Parameter,waterdesalinatedgr:  Desalinated water initial growth rate,cyan,
waterdesalinatedm,1195,11,Water,Water: Desalination,2,Parameter,waterdesalinatedm:  Desalinated water multiplier,cyan,
waterefficiencym,1196,11,Water,Water: Waste,2,Parameter,waterefficiencym:  Water demand multiplier--higher is higher demand,cyan,
waterwithdrawalm,1197,11,Water,Water: Withdrawal,2,Parameter,waterwithdrawalm:  Water withdrawal multiplier,cyan,
watresexploitrenewm,1198,11,Water,Water: Resources,2,Parameter,watresexploitrenewm:  Exploitable renewable freshwater resources multiplier,cyan,
ifsexomodelid,1201,11,Other,Other: Other switches,2,Parameter,"ifsexomodelid:  Use Exogenous Series? (0 no, >0 identifies series)",Pink,
HTCTPI,1308,11,Sociopolitical,Sociopolitical: Human Trafficking,1,Variable,HTCTPI:  Human Trafficking Prevalence Index,drakgray,
HTCGRI,1309,11,Sociopolitical,Sociopolitical: Human Trafficking,1,Variable,HTCGRI:  Government Response to Trafficking Index,drakgray,
LANDIRAREAACTUAL,1320,11,Agriculture,Agriculture: Resources,1,Variable,"LANDIRAREAACTUAL:  Irrigation, land area irrigated",Red,
landirareaactualm,1321,11,Agriculture,Agriculture: Resources,2,Parameter,"landirareaactualm:  Irrigation, land area actually irrigated, multiplier",Red,
HLSTUNTWORK,1322,11,Health,Health: Stunting,1,Variable,HLSTUNTWORK:  Stunting Rate in Working age (Percentage of the Working age Pop that is affected by childhood malnutrition).,Purple,
edseclowrgram,1325,11,Education,Education: Graduation,2,Parameter,"edseclowrgram:  Education, Lower Secondary, Graduation rate, multiplier base 1",Yellow,
edseclowrgratrgtyr,1326,11,Education,Education: Graduation,2,Parameter,"edseclowrgratrgtyr:  Education, Sec Lower, Graduation Rate, Target Year (number of years from base year to reach 100%)",Yellow,
INTR,743,3,Economy,Economy: Incomes,1,Variable,INTR:  Interest rates,Green,
invm,744,3,Economy,Economy: Investment,2,Parameter,"invm:  Investment in the economy, multiplier",Green,
INVS,745,3,Economy,Economy: Investment,1,Variable,INVS:  Investment by origin sector,Green,
IRA,746,3,Economy,Economy: Investment,1,Variable,IRA:  Investment ratio to gross domestic product,Green,
KAG,747,1,Agriculture,Agriculture: Investment,1,Variable,KAG:  (K)capital in agriculture (not including land),Red,
edsecupprgram,1328,11,Education,Education: Graduation,2,Parameter,"edsecupprgram:  Education, Upper Secondary, Graduation rate, multiplier base 1",Yellow,
edsecupprgratrgtyr,1329,11,Education,Education: Graduation,2,Parameter,"edsecupprgratrgtyr:  Education, Sec Upper, Graduation Rate, Target Year (number of years from base year to reach 100%)",Yellow,
wastewatertreatedm,1334,11,Water,Water: Waste,2,Parameter,wastewatertreatedm:  treated wastewater multiplier,cyan,
waterrenewconverge,1335,11,Water,Water: Waste,2,Parameter,waterrenewconverge:  time for country to return to exploitable limit of renewable freshwater resources,cyan,
KS,756,3,Economy,Economy: Productivity,1,Variable,KS:  (K)capital by economic sector,Green,
LAB,757,3,Economy,Economy: Productivity,1,Variable,LAB:  Labor,Green,
LABCOEFFS,1359,3,Economy,Economy: Labor,1,Variable,LABCOEFFS:  Labor demand coefficients by sector and skill level,Green,
labcoeffsm,1374,3,Economy,Economy: labor,2,Parameter,"labcoeffsm:  Labor demand, multiplier on technology coefficients",Green,
LABDEMS,1366,3,Economy,Economy: Labor,1,Variable,LABDEMS:  Labor demand by sector,Green,
labdemsm,1375,3,Economy,Economy: Labor,2,Parameter,"labdemsm:  Labor force, multiplier on demand",Green,
LABEMPS,1448,3,Economy,Economy: labor,1,Variable,LABEMPS:  Labor employment by sector and skill,Green,
labfemshrm,758,2,Demography,Demography: Labor,2,Parameter,"labfemshrm:  Labor force, multliplier on female share",Blue,
labinformcoeffbus,,7,Economy,Economy: Labor,2,Parameter,"labinformcoeffbus:  Informal labor share, coefficient of business index",Green,
labinformcoeffed,,7,Economy,Economy: Labor,2,Parameter,"labinformcoeffed:  Informal labor share,coefficient of education years",Green,
labinformcoeffhhtrn,,7,Economy,Economy: Labor,2,Parameter,"labinformcoeffhhtrn:  Informal labor share, coefficient of household transfers",Green,
labinformcoeffintercept,,7,Economy,Economy: Labor,2,Parameter,"labinformcoeffintercept:  Informal labor share, intercept of model",Green,
labinformcoefftax,,7,Economy,Economy: Labor,2,Parameter,"labinformcoefftax:  Informal labor share, coefficient of taxation",Green,
LABINFORMPCNTINF,,3,Economy,Economy: Informal Economy,1,Variable,"LABINFORMPCNTINF:  Informal Employment, Percent Working in Informal Enterprises",Green,
LABINFORMPCNTNONINF,,3,Economy,Economy: Informal Economy,1,Variable,"LABINFORMPCNTNONINF:  Informal Employment, Percent Working in Households and Formal Enterprises",Green,
LABINFORMSHR,,3,Economy,Economy: Informal Economy,1,Variable,"LABINFORMSHR:  Informal Employment (Labor) Share of Total, Non-Agricultural",Green,
labinformshrm,,3,Economy,Economy: Labor,2,Parameter,labinformshrm:  Informal labor share multiplier,Green,
labmarketsw,1367,3,Economy,Economy: Labor,2,Parameter,labmarketsw:  Labor demand to economic production switch (1=on),Green,
labparm,1348,3,Economy,Economy: Labor,2,Parameter,labparm:  Labor participation rate multiplier,Green,
LABPARR,1347,3,Economy,Economy: Labor,1,Variable,"LABPARR:  Labor participation rate, 15 and older, as a percentage of the age-group population",Green,
labretagem,759,2,Demography,Demography: Labor,2,Parameter,"labretagem:  Labor force, multliplier on retirement age",Blue,
LABS,760,3,Economy,Economy: Labor,1,Variable,LABS:  Labor by sector,Green,
LABSUP,761,3,Economy,Economy: Labor,1,Variable,LABSUP:  Labor supply by skill level,Green,
LABUNEMPR,1349,3,Economy,Economy: Labor,1,Variable,LABUNEMPR:  Labor unemployment rate,Green,
labwageincfac,1501,3,Economy,Economy: Labor,2,Parameter,labwageincfac:  Factor to convert wage changes into household income changes,Green,
LABWAGEIND,1353,3,Economy,Economy: Labor,1,Variable,LABWAGEIND:  Labor wage index,Green,
LABWAGES,1449,3,Economy,Economy: Labor,1,Variable,LABWAGES:  Labor wage per person by sector and skill,Green,
LABWAGESEXRAT,1354,3,Economy,Economy: Labor,1,Variable,"LABWAGESEXRAT:  Labor wage ratio by sex, female wage as a ratio of male wage",Green,
LABWAGESSHRSKL,1452,3,Economy,Economy: Labor,1,Variable,"LABWAGESSHRSKL:  Labor wage, share of sector total by skill level",Green,
landarablepot,762,1,Agriculture,Agriculture: Resources,2,Parameter,landarablepot:  Potentially Arable Land,Red,
watdemandelas,1413,11,Water,Water: Demand,2,Parameter,watdemandelas:  elasticity from water price to water demand,cyan,
landirareaequipelas,1414,11,Agriculture,Agriculture: Resources,2,Parameter,landirareaequipelas:  elasticity from water price to land equipped for irrigation,Red,
druguseamphetaminem,1421,11,Sociopolitical,Sociopolitical: Drug Demand,2,Parameter,druguseamphetaminem:  Amphetamine prevalence multiplier,drakgray,
drugusecocainem,1422,11,Sociopolitical,Sociopolitical: Drug Demand,2,Parameter,drugusecocainem:  Cocaine prevalence multiplier,drakgray,
druguseopiatesm,1423,11,Sociopolitical,Sociopolitical: Drug Demand,2,Parameter,druguseopiatesm:  Opiates prevalence multiplier,drakgray,
druguseprescriptopioidm,1424,11,Sociopolitical,Sociopolitical: Drug Demand,2,Parameter,druguseprescriptopioidm:  Prescription opioid prevalence multiplier,drakgray,
SVDTHSPOLICS,1427,11,Sociopolitical,Sociopolitical: Violence,1,Variable,SVDTHSPOLICS:  Deaths from police violence and executions,drakgray,
SVDTHSWOMENCHILDREN,1428,11,Sociopolitical,Sociopolitical: Violence,1,Variable,SVDTHSWOMENCHILDREN:  Deaths of women and children from interpersonal violence,drakgray,
SVDTHSOTHERINTERPERSON,1429,11,Sociopolitical,Sociopolitical: Violence,1,Variable,SVDTHSOTHERINTERPERSON:  Deaths of others from interpersonal violence,drakgray,
SOCIETALVIOLENCEDEATHS,1430,11,Sociopolitical,Sociopolitical: Violence,1,Variable,SOCIETALVIOLENCEDEATHS:  Deaths from societal violence,drakgray,
LAPOPR,773,3,Economy,Economy: Labor,1,Variable,LAPOPR:  Labor participation rate,Green,
lapoprm,774,3,Economy,Economy: Labor,2,Parameter,lapoprm:  Labor participation rate multiplier,Green,
LD,775,1,Agriculture,Agriculture: Resources,1,Variable,LD:  Land,Red,
ldcropm,776,1,Agriculture,Agriculture: Resources,2,Parameter,ldcropm:  Crop land multiplier,Red,
LIFEXP,779,2,Demography,Demography: Health,1,Variable,LIFEXP:  Life expectancy,Blue,
LIFEXPHLM,780,2,Demography,Demography: Health,1,Variable,"LIFEXPHLM:  Life expectancy at Birth, from Health Module",Blue,
lifexpmin,781,9,Sociopolitical,Sociopolitical: Human Development,2,Parameter,lifexpmin:  Life expectancy minimum for PQLI calculation,drakgray,
lintr,782,3,Economy,Economy: Investment,2,Parameter,"lintr:  Loan interest rate, global",Green,
LIQUIDITY,783,3,Economy,Economy: Investment,1,Variable,LIQUIDITY:  Liquidity - current account as % of reserves,Green,
LIT,784,4,Education,Education: Years of Education,1,Variable,"LIT:  Literacy, percentage of population, 15 and older",Yellow,
livhdpro,785,1,Agriculture,Agriculture: Resources,2,Parameter,livhdpro:  Livestock herd productivity gain with grain feeding,Red,
lke,786,5,Energy,Energy: Prices,2,Parameter,lke:  Lifetime of energy capital,Orange,
lks,787,3,Economy,Economy: Investment,1,Variable,lks:  Lifetime of capital by sector,Green,
lvcf,790,1,Agriculture,Agriculture: Resources,2,Parameter,"lvcf:  Livestock to calorie conversion factor, compared to crops",Red,
LVHERD,791,1,Agriculture,Agriculture: Resources,1,Variable,LVHERD:  Livestock herd,Red,
M,792,3,Economy,Economy: Trade,1,Variable,M:  iMports,Green,
malelimprecisesw,1296,1,Agriculture,Agriculture: Nutrition,2,Parameter,malelimprecisesw:  Switch to turn on (1=on) elimination of hunger only for undernourished pop,Red,
malemigr,793,2,Demography,Demography: Migration,2,Parameter,malemigr:  Male migration as a portion of total migration,Blue,
MALNCHIL,794,2,Demography,Demography: Nutrition,1,Variable,MALNCHIL:  Malnourished children (under 5),Blue,
MALNCHP,795,2,Demography,Demography: Nutrition,1,Variable,MALNCHP:  Malnourished children (under 5) as percent,Blue,
MALNCHPSAM,1273,2,Demography,Demography: Nutrition,1,Variable,MALNCHPSAM:  Children who suffer from severe acute malnourishment (SAM) as a percent of under 5 population,Blue,
malnchpsamadj,1291,2,Demography,Demography: Nutrition,2,Parameter,malnchpsamadj:  Severe Acute Malnutrition Incidence adjustment,Blue,
MALNCHPSAMINC,1293,2,Demography,Demography: Nutrition,1,Variable,MALNCHPSAMINC:  Incidence of Children who suffer from severe acute malnourishment (SAM) as a percent of under 5 population,Blue,
malnchpsamm,1274,2,Demography,Demography: Nutrition,2,Parameter,"malnchpsamm:  Severe Acute Malnutrition, multiplier",Blue,
malnchpsamtostunt,1279,2,Demography,Demography: Nutrition,2,Parameter,malnchpsamtostunt:  Severe Acute Malnutrition effect on stunting,Blue,
MALNCHPSH,796,2,Demography,Demography: Nutrition,1,Variable,"MALNCHPSH:  Malnourished children as percent, Smith and Haddad Formulation",Blue,
malnconv,797,2,Demography,Demography: Nutrition,2,Parameter,"malnconv:  Malnutrition, convergence time to expected value",Blue,
malnelimtargetyr,1295,1,Agriculture,Agriculture: Nutrition,2,Parameter,malnelimtargetyr:  Target year for an elimination of hunger scenario - works with malnelimstartyr,Red,
malnhldsw,798,2,Demography,Demography: Nutrition,2,Parameter,malnhldsw:  Malnutrition hold switch,Blue,
malnm,799,2,Demography,Demography: Nutrition,2,Parameter,"malnm:  Malnutrition, multiplier",Blue,
MALNPOPP,800,2,Demography,Demography: Nutrition,1,Variable,MALNPOPP:  Malnourished population as percent,Blue,
MATPOSTR,801,9,Sociopolitical,Sociopolitical: Human Development,1,Variable,MATPOSTR:  Materialism/postmaterialism index,drakgray,
matpostradd,802,9,Sociopolitical,Sociopolitical: Human Development,2,Parameter,matpostradd:  Materialism/postmaterialism index addition,drakgray,
meatmax,803,1,Agriculture,Agriculture: Nutrition,2,Parameter,"meatmax:  Meat consumption, maximum per year per person",Red,
mfpadd,804,3,Economy,Economy: Productivity,2,Parameter,mfpadd:  Multifactor productivity growth additive factor,Green,
MFPBAS,805,3,Economy,Economy: Productivity,1,Variable,"MFPBAS:  Multifactor productivity, systemic technology base",Green,
mfpbasgr,806,3,Economy,Economy: Productivity,2,Parameter,"mfpbasgr:  Elasticity of multifactor productivity, basic growth rate",Green,
mfpbasinc,807,3,Economy,Economy: Productivity,2,Parameter,"mfpbasinc:  Elasticity of multifactor productivity, basic growth rate increment",Green,
mfpconflict,808,3,Economy,Economy: Productivity,2,Parameter,mfpconflict:  Elasticity of multifactor productivity to domestic conflict,Green,
mfpconv,809,3,Economy,Economy: Productivity,2,Parameter,"mfpconv:  Multifactor productivity growth, convergence time to global function",Green,
mfpconv2,810,3,Economy,Economy: Productivity,2,Parameter,"mfpconv2:  Multifactor productivity growth in ICT, convergence time to the service sector",Green,
MFPCOR,811,3,Economy,Economy: Productivity,1,Variable,"MFPCOR:  Multifactor productivity, correction for empirical growth",Green,
MFPCORS,1183,3,Economy,Economy: Productivity,1,Variable,"MFPCORS:  Multifactor productivity, correction for empirical growth by sector",Green,
mfpdemoc,812,3,Economy,Economy: Productivity,2,Parameter,mfpdemoc:  Elasticity of multifactor productivity to democracy,Green,
mfpeconint,813,3,Economy,Economy: Productivity,2,Parameter,mfpeconint:  Elasticity of multifactor productivity to economic integration,Green,
mfpedlifexp,814,3,Economy,Economy: Productivity,2,Parameter,mfpedlifexp:  Responsiveness of years of education (age 15) in MFP calculation to extra years of life expectancy,Green,
mfpedspn,815,3,Economy,Economy: Productivity,2,Parameter,mfpedspn:  Elasticity of multifactor productivity to education spending,Green,
mfpedyrs,816,3,Economy,Economy: Productivity,2,Parameter,mfpedyrs:  Elasticity of multifactor productivity to years of education at 15+,Green,
mfpefree,817,3,Economy,Economy: Productivity,2,Parameter,mfpefree:  Elasticity of multifactor productivity to economic freedom,Green,
mfpfree,819,3,Economy,Economy: Productivity,2,Parameter,mfpfree:  Elasticity of multifactor productivity to freedom,Green,
mfpgovcor,820,3,Economy,Economy: Productivity,2,Parameter,mfpgovcor:  Elasticity of multifactor productivity to government corruption,Green,
mfpgoveff,821,3,Economy,Economy: Productivity,2,Parameter,mfpgoveff:  Elasticity of multifactor productivity to government effectiveness,Green,
MFPHC,822,3,Economy,Economy: Productivity,1,Variable,MFPHC:  Multifactor productivity contribution from human capital,Green,
mfpinfrindict,827,3,Economy,Economy: Productivity,2,Parameter,"mfpinfrindict:  Elasticity of multifactor productivity to infrastructure index, ICT",Green,
mfpinfrindtrad,828,3,Economy,Economy: Productivity,2,Parameter,"mfpinfrindtrad:  Elasticity of multifactor productivity to infrastructure index, traditional",Green,
mfpiospn,1502,3,Economy,Economy: Productivity,2,Parameter,mfpiospn:  Elasticity of multifactor productivity to other infrastructure spending,Green,
MFPKN,832,3,Economy,Economy: Productivity,1,Variable,MFPKN:  Multifactor productivity contribution from knowledge creation and diffusion,Green,
mfpleadr,833,3,Economy,Economy: Productivity,2,Parameter,mfpleadr:  Multifactor productivity growth rate of system leader,Green,
MFPPC,835,3,Economy,Economy: Productivity,1,Variable,MFPPC:  Multifactor productivity contribution from physical capital (incl infrastructure),Green,
MFPPCDEM,836,3,Economy,Economy: Productivity,1,Variable,"MFPPCDEM:  Multifactor productivity contribution from physical capital (incl infrastructure), Desired",Green,
mfprandd,837,3,Economy,Economy: Productivity,2,Parameter,mfprandd:  Elasticity of multifactor productivity to research and development,Green,
MFPRATE,838,3,Economy,Economy: Productivity,1,Variable,"MFPRATE:  Multifactor productivity rate, computed sectoral",Green,
MFPRATET,839,3,Economy,Economy: Productivity,1,Variable,"MFPRATET:  Multifactor productivity rate, computed total",Green,
MFPSC,840,3,Economy,Economy: Productivity,1,Variable,MFPSC:  Multifactor productivity contribution from social capital (incl goverance),Green,
MFPSCCONFL,841,3,Economy,Economy: Productivity,1,Variable,"MFPSCCONFL:  Multifactor productivity contribution from social capital, increment from conflict",Green,
mfpstunt,842,3,Economy,Economy: Productivity,2,Parameter,mfpstunt:  Elasticity of multifactor productivity to Stunting,Green,
MFPTOT,843,3,Economy,Economy: Productivity,1,Variable,MFPTOT:  Multifactor productivity contribution from all sources,Green,
MIGRANTS,845,2,Demography,Demography: Migration,1,Variable,"MIGRANTS:  Migrants (inward), net",Blue,
MIGRANTSFORCEDOUT,1401,2,Demography,Demography: Migration,1,Variable,MIGRANTSFORCEDOUT:  Migrants Forced outward,Blue,
MIGRANTSFORCEDRETURN,1402,2,Demography,Demography: Migration,1,Variable,MIGRANTSFORCEDRETURN:  Migrants Forced out Returning,Blue,
MIGRANTSIN,1378,2,Demography,Demography: Migration,1,Variable,MIGRANTSIN:  Migrants inward,Blue,
MIGRANTSOUT,1377,2,Demography,Demography: Migration,1,Variable,MIGRANTSOUT:  Migrants outward,Blue,
MIGRANTSVOLIN,1404,2,Demography,Demography: Migration,1,Variable,MIGRANTSVOLIN:  Migrants Voluntary inward,Blue,
MIGRANTSVOLOUT,1403,2,Demography,Demography: Migration,1,Variable,MIGRANTSVOLOUT:  Migrants Voluntary outward,Blue,
MIGRATE,846,2,Demography,Demography: Migration,1,Variable,"MIGRATE:  Migration rate(inward), net computed, percent of population",Blue,
migratebalancesw,1384,3,Demography,Demography: Migration,2,Parameter,migratebalancesw:  Dyadic migration balance switch,Blue,
MIGRATEIN,1380,2,Demography,Demography: Migration,1,Variable,"MIGRATEIN:  Migration rate inward, percent of population",Blue,
migrateinm,1382,2,Demography,Demography: Migration,2,Parameter,migrateinm:  Migration rate inward multiplier,Blue,
MIGRATEOUT,1379,2,Demography,Demography: Migration,1,Variable,"MIGRATEOUT:  Migration rate outward, percent of population",Blue,
migrateoutm,1381,2,Demography,Demography: Migration,2,Parameter,migrateoutm:  Migration rate outward multiplier,Blue,
migrater,847,2,Demography,Demography: Migration,2,Parameter,"migrater:  Migration rate (inward), net percent of population",Blue,
mortconv,850,2,Demography,Demography: Mortality,2,Parameter,"mortconv:  Mortality, convergence time to expected value",Blue,
mortm,851,2,Demography,Demography: Mortality,2,Parameter,mortm:  Mortality multiplier,Blue,
MORTMG,852,9,Health,Health: Mortality,1,Variable,MORTMG:  Mortality multiplier from government expenditures,Purple,
mprconv,853,9,Sociopolitical,Sociopolitical: Human Development,2,Parameter,"mprconv:  Materialism/postmaterialism, convergence time  to expected",drakgray,
