NAME,VARID,ModuleNo,Module,SubModel,TYPE,TYPE NAME,ID2,Color,
ictbroadsetar,586,11,Infrastructure,Infrastructure: ICT,2,Parameter,"ictbroadsetar:  Infrastructure, ICT Fixed BroadBand, strandard error target",Brown,
ictbroadseyrtar,587,11,Infrastructure,Infrastructure: ICT,2,Parameter,"ictbroadseyrtar:  Infrastructure, ICT Fixed BroadBand, years to target standard error",Brown,
ictbroadtechighrt,588,11,Infrastructure,Infrastructure: ICT,2,Parameter,ictbroadtechighrt:  Maximum Growth in Technological factor for Broadband Internet Access.,Brown,
ictbroadtecinflection,589,11,Infrastructure,Infrastructure: ICT,2,Parameter,ictbroadtecinflection:  Penetration Rate at which Growth in Technological factor starts to decrease for Broadband Internet Access.,Brown,
ictbroadteclowrt,590,11,Infrastructure,Infrastructure: ICT,2,Parameter,ictbroadteclowrt:  Minimum Growth in Technological factor for Broadband Internet Access.,Brown,
ictbroadtrgtval,591,11,Infrastructure,Infrastructure: ICT,2,Parameter,"ictbroadtrgtval:  Fixed broadband access, value for fixed target, works with ictbroadtrgtyr",Brown,
ictbroadtrgtyr,592,11,Infrastructure,Infrastructure: ICT,2,Parameter,ictbroadtrgtyr:  Universal Fixed Broadband Access Target Year (number of years from starting point),Brown,
ictbroadurimpmax,593,11,Infrastructure,Infrastructure: ICT,2,Parameter,"ictbroadurimpmax:  Broadband, fixed, impact from urbanization, maximum",Brown,
ictbroadurimpmin,594,11,Infrastructure,Infrastructure: ICT,2,Parameter,"ictbroadurimpmin:  Broadband, fixed, impact from urbanization, minimum",Brown,
ICTCOMPUTERS,595,11,Infrastructure,Infrastructure: ICT,1,Variable,ICTCOMPUTERS:  Percentage of Households with Personal Computer,Brown,
ictcomputerstechighrt,596,11,Infrastructure,Infrastructure: ICT,2,Parameter,ictcomputerstechighrt:  Maximum Growth in Technological factor for personal computers ownership,Brown,
ictcomputerstecinflection,597,11,Infrastructure,Infrastructure: ICT,2,Parameter,ictcomputerstecinflection:  Penetration Rate at which Growth in Technological factor starts to decrease for personal computers ownership,Brown,
ictcomputersteclowrt,598,11,Infrastructure,Infrastructure: ICT,2,Parameter,ictcomputersteclowrt:  Minimum Growth in Technological factor for personal computers ownership,Brown,
ICTINDEX,599,11,Infrastructure,Infrastructure: ICT,1,Variable,"ICTINDEX:  ICT index, physical capacity",Brown,
ICTMOBIL,601,11,Infrastructure,Infrastructure: ICT,1,Variable,ICTMOBIL:  Mobile phones per 100 people,Brown,
ICTMOBILCOST,602,11,Infrastructure,Infrastructure: ICT,1,Variable,"ICTMOBILCOST:  Infrastructure, ICT, mobile, cost of adding a subscriber",Brown,
ictmobilcostm,604,11,Infrastructure,Infrastructure: ICT,2,Parameter,"ictmobilcostm:  Infrastructure, ICT, mobile, multiplier on cost of adding a subscriber",Brown,
ICTMOBILDEM,606,11,Infrastructure,Infrastructure: ICT,1,Variable,"ICTMOBILDEM:  Percentage of Population with Mobile Phone, demand",Brown,
ictmobilsaturation,608,11,Infrastructure,Infrastructure: ICT,2,Parameter,ictmobilsaturation:  Maximum number of mobile phone or mobile broadband per 100 people,Brown,
ictmobilsetar,609,11,Infrastructure,Infrastructure: ICT,2,Parameter,"ictmobilsetar:  Infrastructure, ICT Mobile Phones, strandard error target",Brown,
ictmobilseyrtar,610,11,Infrastructure,Infrastructure: ICT,2,Parameter,"ictmobilseyrtar:  Infrastructure, ICT Mobile Phones, years to target standard error",Brown,
ictmobiltechighrt,611,11,Infrastructure,Infrastructure: ICT,2,Parameter,ictmobiltechighrt:  Maximum Growth in Technological factor for Mobile Phone Access.,Brown,
ictmobiltecinflection,612,11,Infrastructure,Infrastructure: ICT,2,Parameter,ictmobiltecinflection:  Penetration Rate at which Growth in Technological factor starts to decrease for Mobile Phone Access.,Brown,
ictmobilteclowrt,613,11,Infrastructure,Infrastructure: ICT,2,Parameter,ictmobilteclowrt:  Minimum Growth in Technological factor for Mobile Phone Access.,Brown,
ICTSPEND,615,11,Infrastructure,Infrastructure: ICT,1,Variable,"ICTSPEND:  Information communication technology spending, percent of GDP",Brown,
ictspendm,616,11,Infrastructure,Infrastructure: ICT,2,Parameter,ictspendm:  ICT spending multiplier,Brown,
INFRABUDDEMMNT,634,11,Infrastructure,Infrastructure: Budget,1,Variable,"INFRABUDDEMMNT:  Infrastructure, initial demand for public funds, maintenance, before budget reconciliation",Brown,
INFRABUDDEMNEW,635,11,Infrastructure,Infrastructure: Budget,1,Variable,"INFRABUDDEMNEW:  Infrastructure, initial demand for public funds, new construction, before budget reconciliation",Brown,
INFRAELEC,639,11,Infrastructure,Infrastructure: Electricity,1,Variable,"INFRAELEC:  Infrastructure, electricity use intensity",Brown,
INFRAELECACC,640,11,Infrastructure,Infrastructure: Electricity,1,Variable,"INFRAELECACC:  Electricity, percent of population with access",Brown,
INFRAELECACCDEM,641,11,Infrastructure,Infrastructure: Electricity,1,Variable,"INFRAELECACCDEM:  Electricity, percent of population with access, desired",Brown,
infraelecaccm,642,11,Infrastructure,Infrastructure: Electricity,2,Parameter,"infraelecaccm:  Electricity access, multiplier",Brown,
INFRAELECACCRURALCOST,643,11,Infrastructure,Infrastructure: Electricity,1,Variable,"INFRAELECACCRURALCOST:  Infrastructure, electricity access , rural, cost of a new connection (including transmission and distribution)",Brown,
infraelecaccruralcostm,645,11,Infrastructure,Infrastructure: Electricity,2,Parameter,"infraelecaccruralcostm:  Infrastructure, electricity access, rural, multiplier on cost of adding a connection",Brown,
hlstuntyrs,1300,2,Health,Health: Stunting,2,Parameter,hlstuntyrs:  Stunting years for moving average,Purple,
infraelecaccsetar,648,11,Infrastructure,Infrastructure: Electricity,2,Parameter,"infraelecaccsetar:  Infrastructure, electricity access, strandard error target",Brown,
infraelecaccseyrtar,649,11,Infrastructure,Infrastructure: Electricity,2,Parameter,"infraelecaccseyrtar:  Infrastructure, electricity access, years to target standard error",Brown,
infraelecacctrgtval,650,11,Infrastructure,Infrastructure: Electricity,2,Parameter,"infraelecacctrgtval:  Electricity access target, value for fixed target,  works with infraelecacctrgtyr",Brown,
infraelecacctrgtyr,651,11,Infrastructure,Infrastructure: Electricity,2,Parameter,infraelecacctrgtyr:  Universal Electricity Access Target Year (number of years from starting point),Brown,
INFRAELECACCURBANCOST,652,11,Infrastructure,Infrastructure: Electricity,1,Variable,"INFRAELECACCURBANCOST:  Infrastructure, electricity access , urban, cost of a new connection (including transmission and distribution)",Brown,
infraelecaccurbancostm,654,11,Infrastructure,Infrastructure: Electricity,2,Parameter,"infraelecaccurbancostm:  Infrastructure, electricity access, urban, multiplier on cost of adding a connection",Brown,
INFRAELECADJFACT,657,11,Infrastructure,Infrastructure: Electricity,1,Variable,"INFRAELECADJFACT:  Energy, electricity, adjustment factor between capacity and production",Brown,
INFRAELECCONSPRODRATIO,660,11,Infrastructure,Infrastructure: Electricity,1,Variable,"INFRAELECCONSPRODRATIO:  Energy, electricity, ratio of production to consumption",Brown,
INFRAELECGENCAP,661,11,Infrastructure,Infrastructure: Electricity,1,Variable,INFRAELECGENCAP:  Electricity generation capacity per person,Brown,
INFRAELECGENCAPDEM,662,11,Infrastructure,Infrastructure: Electricity,1,Variable,"INFRAELECGENCAPDEM:  Infrastructure, electricity, generation capacity per person, desired",Brown,
HPI1,557,9,Sociopolitical,Sociopolitical: Human Development,1,Variable,"HPI1:  Human poverty index 1, UN Development Program's measure",drakgray,
infraelecgencapm,664,11,Infrastructure,Infrastructure: Electricity,2,Parameter,"infraelecgencapm:  Infrastructure, electricity, generation capacity per person, multiplier",Brown,
INFRAELECGENCOST,665,11,Infrastructure,Infrastructure: Electricity,1,Variable,"INFRAELECGENCOST:  Infrastructure, electricity, cost of adding a kilowatt of generation capacity with associated network cost",Brown,
I,559,3,Economy,Economy: Investment,1,Variable,I:  Investment,Green,
IALK,560,1,Agriculture,Agriculture: Investment,2,Parameter,"IALK:  Investment in agriculture, land share",Red,
infraelecgencostm,667,11,Infrastructure,Infrastructure: Electricity,2,Parameter,"infraelecgencostm:  Infrastructure, electricity, multiplier on cost of adding a kilowatt",Brown,
INFRAELECPROD,670,11,Infrastructure,Infrastructure: Electricity,1,Variable,"INFRAELECPROD:  Infrastructure, electricity, production",Brown,
INFRAELECTRANLOSS,671,11,Infrastructure,Infrastructure: Electricity,1,Variable,"INFRAELECTRANLOSS:  Energy, electricity, transmission and distribution loss as a percentage of total production",Brown,
infraelectranlossm,672,11,Infrastructure,Infrastructure: Electricity,2,Parameter,"infraelectranlossm:  Energy, electricity, transmission and distribution loss, multiplier",Brown,
INFRAINDELEC,674,11,Infrastructure,Infrastructure: Electricity,1,Variable,"INFRAINDELEC:  Infrastructure index, electricity sub-index",Brown,
INFRAINDELECCOMPMEANI,675,11,Infrastructure,Infrastructure: Electricity,1,Variable,"INFRAINDELECCOMPMEANI:  Infrastructure index, electricity, component initial mean",Brown,
INFRAINDELECCOMPSDI,676,11,Infrastructure,Infrastructure: Electricity,1,Variable,"INFRAINDELECCOMPSDI:  Infrastructure index, electricity, component initial standard deviation",Brown,
infraindeleccompwt,677,11,Infrastructure,Infrastructure: Electricity,2,Parameter,"infraindeleccompwt:  Infrastructure index, electricity, component weight (1=equal weighting, 0=not included)",Brown,
INFRAINDICT,678,11,Infrastructure,Infrastructure: Infrastructure Index,1,Variable,"INFRAINDICT:  Infrastructure index, ICT Only",Brown,
infraindictcompwt,679,11,Infrastructure,Infrastructure: Infrastructure Index,2,Parameter,"infraindictcompwt:  Infrastructure index, ICT, component weight (1=equal weighting, 0=not included)",Brown,
INFRAINDICTDEM,680,11,Infrastructure,Infrastructure: Infrastructure Index,1,Variable,"INFRAINDICTDEM:  Infrastructure index, ICT Only, Desired",Brown,
INFRAINDICTZ,681,11,Infrastructure,Infrastructure: Infrastructure Index,1,Variable,"INFRAINDICTZ:  Infrastructure index, ICT index with Z-score formulation",Brown,
INFRAINDICTZCOMPMEANI,682,11,Infrastructure,Infrastructure: Infrastructure Index,1,Variable,"INFRAINDICTZCOMPMEANI:  Infrastructure index, ICTZ, component initial mean",Brown,
INFRAINDICTZCOMPSDI,683,11,Infrastructure,Infrastructure: Infrastructure Index,1,Variable,"INFRAINDICTZCOMPSDI:  Infrastructure index, ICTZ, component initial standard deviation",Brown,
infraindictzcompwt,684,11,Infrastructure,Infrastructure: Infrastructure Index,2,Parameter,"infraindictzcompwt:  Infrastructure index,ICTZ, component weight (1=equal weighting, 0=not included)",Brown,
INFRAINDTRAD,685,11,Infrastructure,Infrastructure: Infrastructure Index,1,Variable,"INFRAINDTRAD:  Infrastructure index, Traditional",Brown,
INFRAINDTRADDEM,689,11,Infrastructure,Infrastructure: Infrastructure Index,1,Variable,"INFRAINDTRADDEM:  Infrastructure index, Traditional, Desired",Brown,
INFRAINDTRADEXP,690,11,Infrastructure,Infrastructure: Infrastructure Index,1,Variable,"INFRAINDTRADEXP:  Infrastructure index, traditional, expected value for MFPPC contribution",Brown,
INFRAINDTRAN,691,11,Infrastructure,Infrastructure: Infrastructure Index,1,Variable,"INFRAINDTRAN:  Infrastructure index, transportation sub-index",Brown,
INFRAINDTRANCOMPMEANI,692,11,Infrastructure,Infrastructure: Infrastructure Index,1,Variable,"INFRAINDTRANCOMPMEANI:  Infrastructure index, transportation, component initial mean",Brown,
INFRAINDTRANCOMPSDI,693,11,Infrastructure,Infrastructure: Infrastructure Index,1,Variable,"INFRAINDTRANCOMPSDI:  Infrastructure index, transportation, component initial standard deviation",Brown,
infraindtrancompwt,694,11,Infrastructure,Infrastructure: Infrastructure Index,2,Parameter,"infraindtrancompwt:  Infrastructure index, transportation, component weight (1=equal weighting, 0=not included)",Brown,
INFRAINDWATSAN,695,11,Infrastructure,Infrastructure: Infrastructure Index,1,Variable,"INFRAINDWATSAN:  Infrastructure index, water and sanitation sub-index",Brown,
INFRAINDWATSANCOMPMEANI,696,11,Infrastructure,Infrastructure: Infrastructure Index,1,Variable,"INFRAINDWATSANCOMPMEANI:  Infrastructure index, water and sanitation, component initial mean",Brown,
INFRAINDWATSANCOMPSDI,697,11,Infrastructure,Infrastructure: Infrastructure Index,1,Variable,"INFRAINDWATSANCOMPSDI:  Infrastructure index, water and sanitation, component initial standard deviation",Brown,
infraindwatsancompwt,698,11,Infrastructure,Infrastructure: Infrastructure Index,2,Parameter,"infraindwatsancompwt:  Infrastructure index, water and sanitation, component weight (1=equal weighting, 0=not included)",Brown,
INFRAINVESTMAINT,699,11,Infrastructure,Infrastructure: Investment,1,Variable,"INFRAINVESTMAINT:  Infrastructure investment needed, maintenance",Brown,
INFRAINVESTMAINTPUB,700,11,Infrastructure,Infrastructure: Investment,1,Variable,"INFRAINVESTMAINTPUB:  Infrastructure investment needed, maintenance, public",Brown,
INFRAINVESTNEW,701,11,Infrastructure,Infrastructure: Investment,1,Variable,"INFRAINVESTNEW:  Infrastructure investment needed, new construction",Brown,
INFRAINVESTNEWPUB,702,11,Infrastructure,Infrastructure: Investment,1,Variable,"INFRAINVESTNEWPUB:  Infrastructure investment needed, new construction, public",Brown,
infrainvmaintpubshrm,703,11,Infrastructure,Infrastructure: Investment,2,Parameter,"infrainvmaintpubshrm:  Infrastructure, portion of maintenance fund coming from public sector",Brown,
infrainvnewpubshrm,704,11,Infrastructure,Infrastructure: Investment,2,Parameter,"infrainvnewpubshrm:  Infrastructure, portion of new construction fund coming from public sector",Brown,
INFRANET,706,11,Infrastructure,Infrastructure: ICT,1,Variable,"INFRANET:  Infrastructure, internet use density",Brown,
infranetm,707,11,Infrastructure,Infrastructure: ICT,2,Parameter,"infranetm:  Infrastructure, internet density, multiplier",Brown,
INFRAROAD,710,11,Infrastructure,Infrastructure: Roads,1,Variable,"INFRAROAD:  Infrastructure, road network density (roads per land area)",Brown,
INFRAROADDEM,711,11,Infrastructure,Infrastructure: Roads,1,Variable,"INFRAROADDEM:  Infrastructure, road network density (roads per land area), demand",Brown,
infraroadm,712,11,Infrastructure,Infrastructure: Roads,2,Parameter,"infraroadm:  Road network density (roads per land area), multiplier",Brown,
INFRAROADPAVEDCOST,713,11,Infrastructure,Infrastructure: Roads,1,Variable,"INFRAROADPAVEDCOST:  Infrastructure, road, cost of adding a lane-km of paved road",Brown,
infraroadpavedcostm,715,11,Infrastructure,Infrastructure: Roads,2,Parameter,"infraroadpavedcostm:  Infrastructure, Road Construction Cost Paved, multiplier",Brown,
INFRAROADPAVEDPCNT,718,11,Infrastructure,Infrastructure: Roads,1,Variable,"INFRAROADPAVEDPCNT:  Infrastructure, road network, percentage paved",Brown,
INFRAROADPAVEDPCNTDEM,719,11,Infrastructure,Infrastructure: Roads,1,Variable,"INFRAROADPAVEDPCNTDEM:  Infrastructure, road network, percentage paved, demand",Brown,
infraroadpavedpcntm,720,11,Infrastructure,Infrastructure: Roads,2,Parameter,"infraroadpavedpcntm:  Infrastructure, road network, percentage paved, multiplier",Brown,
INFRAROADRAI,721,11,Infrastructure,Infrastructure: Roads,1,Variable,"INFRAROADRAI:  Rural access index, share of rural people living within two km of  an all weather road",Brown,
INFRAROADRAIDEM,722,11,Infrastructure,Infrastructure: Roads,1,Variable,"INFRAROADRAIDEM:  Infrastructure, road, rural access index desired, shr of rural ppl living within two km of  a all weather road",Brown,
infraroadraisetar,723,11,Infrastructure,Infrastructure: Roads,2,Parameter,"infraroadraisetar:  Infrastructure, rural road access, target standard error, number",Brown,
infraroadraiseyrtar,724,11,Infrastructure,Infrastructure: Roads,2,Parameter,"infraroadraiseyrtar:  Infrastructure, rural road access, target standard error, years to attain",Brown,
infraroadraitrgtval,725,11,Infrastructure,Infrastructure: Roads,2,Parameter,"infraroadraitrgtval:  Infrastructure, rural road access,  value for universal target,  works with infraroadraitrgtyr",Brown,
infraroadraitrgtyr,726,11,Infrastructure,Infrastructure: Roads,2,Parameter,"infraroadraitrgtyr:  Infrastructure, rural road access,  no of years taken (from base year) to reach universal access",Brown,
INFRAROADTOTAL,727,11,Infrastructure,Infrastructure: Roads,1,Variable,"INFRAROADTOTAL:  Infrastructure, road network, total",Brown,
INFRAROADUNPAVEDCOST,728,11,Infrastructure,Infrastructure: Roads,1,Variable,"INFRAROADUNPAVEDCOST:  Infrastructure, road, cost of adding a kilometer of unpaved road",Brown,
infraroadunpavedcostm,730,11,Infrastructure,Infrastructure: Roads,2,Parameter,"infraroadunpavedcostm:  Infrastructure, road construction cost, unpaved, multiplier",Brown,
INFRATELE,733,11,Infrastructure,Infrastructure: Telecommunication,1,Variable,"INFRATELE:  Infrastructure, telephone network density, Line per 100",Brown,
INFRATELECOST,734,11,Infrastructure,Infrastructure: Telecommunication,1,Variable,"INFRATELECOST:  Infrastructure, ICT, telephone, cost of adding a fixed line",Brown,
infratelecostm,736,11,Infrastructure,Infrastructure: Telecommunication,2,Parameter,"infratelecostm:  Infrastructure, ICT, telephone, multiplier on cost of adding a fixed line",Brown,
INFRATELEDEM,738,11,Infrastructure,Infrastructure: Telecommunication,1,Variable,"INFRATELEDEM:  Infrastructure, telephone network density, Line per 100, desired",Brown,
infrateledtfp,739,11,Infrastructure,Infrastructure: Telecommunication,2,Parameter,"infrateledtfp:  Telephone network density, divestment  time, number of years from peak",Brown,
infratelem,741,11,Infrastructure,Infrastructure: Telecommunication,2,Parameter,"infratelem:  Telephone network density, multiplier",Brown,
INFRATELEOLD,742,11,Infrastructure,Infrastructure: Telecommunication,1,Variable,"INFRATELEOLD:  Infrastructure, telephone network density, Line per 100, old formulation",Brown,
keqshr,748,11,Economy,Economy: Capital,2,Parameter,keqshr:  (K)capital equipment share in fixed capital,Green,
KNENVINDEX,749,11,Sociopolitical,Sociopolitical: Knowledge Development,1,Variable,"KNENVINDEX:  Knowledge Systems, Environment (governance and business) Index",drakgray,
KNEXTINDEX,750,11,Sociopolitical,Sociopolitical: Knowledge Development,1,Variable,"KNEXTINDEX:  Knowledge Systems, International transfer, Index",drakgray,
KNHCINDEX,751,11,Sociopolitical,Sociopolitical: Knowledge Development,1,Variable,"KNHCINDEX:  Knowledge Systems, Human Capital Index",drakgray,
KNICTINDEX,752,11,Sociopolitical,Sociopolitical: Knowledge Development,1,Variable,"KNICTINDEX:  Knowledge Systems, ICT Index",drakgray,
KNINNOVINDEX,753,11,Sociopolitical,Sociopolitical: Knowledge Development,1,Variable,"KNINNOVINDEX:  Knowledge Systems, Innovation Index",drakgray,
KNOWSOC,754,11,Sociopolitical,Sociopolitical: Knowledge Development,1,Variable,KNOWSOC:  Knowledge society index; base year 0-100 (better),drakgray,
KNTOTALINDEX,755,11,Sociopolitical,Sociopolitical: Knowledge Development,1,Variable,"KNTOTALINDEX:  Knowledge Systems, Total Index",drakgray,
LANDAREA,763,11,Agriculture,Agriculture: Resources,1,Variable,LANDAREA:  Land area,Red,
LANDIRAREAEQUIP,764,11,Agriculture,Agriculture: Resources,1,Variable,"LANDIRAREAEQUIP:  Irrigation, land area equipped for irrigation",Red,
IDS,617,3,Economy,Economy: Investment,1,Variable,IDS:  Investment by destination,Green,
idsm,1500,3,Economy,Economy: Investment,2,Parameter,"idsm:  Investment in the economy by sector, multiplier",Green,
LANDIRAREAEQUIPDEM,765,11,Agriculture,Agriculture: Resources,1,Variable,"LANDIRAREAEQUIPDEM:  Irrigation, land area equipped for irrigation, demand",Red,
landirareaequipm,766,11,Agriculture,Agriculture: Resources,2,Parameter,"landirareaequipm:  Irrigation, land area equipped for irrigation, multiplier",Red,
IGCF,618,3,Economy,Economy: Investment,1,Variable,"IGCF:  Investment, gross capital formation",Green,
igdpr,619,3,Economy,Economy: GDP,2,Parameter,"igdpr:  Initial GDP growth rate, decimal form",Green,
LANDIRAREASAT,767,11,Agriculture,Agriculture: Resources,1,Variable,"LANDIRAREASAT:  Irrigation, land area for irrigation, saturation value",Red,
INAG,622,1,Agriculture,Agriculture: Investment,1,Variable,INAG:  Investment need in agriculture,Red,
INCOMELT110LN,1174,9,Economy,Economy: Poverty,1,Variable,"INCOMELT110LN:  Population with income less than $1.10 per day, log normal computation (in 2011 US Dollars)",Green,
INCOMELT125CS2005,623,9,Economy,Economy: Poverty,1,Variable,"INCOMELT125CS2005:  Population with income less than $1.25 per day, cross sectional computation (using 2005 ICP based survey data)",Green,
INCOMELT125LN2005,624,9,Economy,Economy: Poverty,1,Variable,"INCOMELT125LN2005:  Population with income less than $1.25 per day, log normal computation (using 2005 ICP  based survey data)",Green,
INCOMELT190LN,1175,9,Economy,Economy: Poverty,1,Variable,"INCOMELT190LN:  Population with income less than $1.9 per day, log normal computation (in 2011 US Dollars)",Green,
INCOMELT200CS2005,625,9,Economy,Economy: Poverty,1,Variable,"INCOMELT200CS2005:  Population with income less than $2 per day, cross sectional computation  (using 2005 ICP based survey data)",Green,
INCOMELT200LN2005,626,9,Economy,Economy: Poverty,1,Variable,"INCOMELT200LN2005:  Population with income less than $2 per day, log normal computation  (using 2005 ICP based survey data)",Green,
INCOMELT310LN,1272,9,Economy,Economy: Poverty,1,Variable,"INCOMELT310LN:  Population with income less than $3.10 per day, log normal computation (in 2011 US Dollars)",Green,
incpovlev,627,3,Economy,Economy: Poverty,2,Parameter,incpovlev:  Income poverty level ($x per day in 2005$),Green,
INDEM,628,1,Agriculture,Agriculture: Demand,1,Variable,INDEM:  Industrial food demand,Red,
indemm,1283,1,Agriculture,Agriculture: Demand,2,Parameter,indemm:  Industrial agricultural demand demand multiplier,Red,
INDIRECTTAX,629,3,Economy,Economy: Taxation,1,Variable,INDIRECTTAX:  Indirect taxes (taxes on goods and services),Green,
INDIRECTTAXR,630,3,Economy,Economy: Taxation,1,Variable,"INDIRECTTAXR:  Indirect taxes (taxes on goods and services), percent of firm income",Green,
indirecttaxrm,631,3,Economy,Economy: Taxation,2,Parameter,indirecttaxrm:  Indirect tax rate multipler,Green,
LANDIRCOST,768,11,Agriculture,Agriculture: Resources,1,Variable,LANDIRCOST:  Per hectare cost of equipping land for irrigation,Red,
INFMOR,632,2,Demography,Demography: Mortality,1,Variable,"INFMOR:  Infant mortality rate per 1,000 live births",Blue,
infmormax,633,9,Economy,Economy: Informal Economy,2,Parameter,infmormax:  Infant mortality maximum for PQLI calculation,Green,
landircostm,770,11,Agriculture,Agriculture: Resources,2,Parameter,landircostm:  Multiplier on per hectare cost of equipping land for irrigation,Red,
mfphlyld,824,11,Economy,Economy: Productivity,2,Parameter,mfphlyld:  Elasticity of multifactor productivity to years of life lost to disability,Green,
SANITATION,927,11,Infrastructure,Infrastructure: Water and Sanitation,1,Variable,"SANITATION:  Sanitation, improved, percent of population with access to",Brown,
SANITATIONCOST,928,11,Infrastructure,Infrastructure: Water and Sanitation,1,Variable,"SANITATIONCOST:  Infrastructure, Sanitation, cost of adding improved sanitation facilities to a household",Brown,
sanitationcostm,930,11,Infrastructure,Infrastructure: Water and Sanitation,2,Parameter,"sanitationcostm:  Infrastructure, Sanitation, multiplier on cost of adding improved sanitation facilities to a household",Brown,
SANITATIONDEM,932,11,Infrastructure,Infrastructure: Water and Sanitation,1,Variable,"SANITATIONDEM:  Sanitation, improved, percent of population with access to, demand",Brown,
SANITATIONIMPCOST,933,11,Infrastructure,Infrastructure: Water and Sanitation,1,Variable,"SANITATIONIMPCOST:  Infrastructure, Sanitation, cost of providing other improved sources, per person",Brown,
sanitationimpcostm,935,11,Infrastructure,Infrastructure: Water and Sanitation,2,Parameter,"sanitationimpcostm:  Infrastructure, Sanitation, multiplier on cost of adding other improve sources, per person",Brown,
sanitationm,939,11,Infrastructure,Infrastructure: Water and Sanitation,2,Parameter,"sanitationm:  Sanitation, improved, percent of population with access to, multiplier",Brown,
sanitationtrgtval,940,11,Infrastructure,Infrastructure: Water and Sanitation,2,Parameter,"sanitationtrgtval:  Sanitation Access Target, value for fixed target, percent with hh connection, works with sanitationtrgtyr",Brown,
sanitationtrgtyr,941,11,Infrastructure,Infrastructure: Water and Sanitation,2,Parameter,sanitationtrgtyr:  Universal Sanitation Access Target Year (number of years from starting point),Brown,
sanithldsw,943,11,Infrastructure,Infrastructure: Water and Sanitation,2,Parameter,sanithldsw:  Sanitation hold switch,Brown,
sanitnoconsetar,945,11,Infrastructure,Infrastructure: Water and Sanitation,2,Parameter,"sanitnoconsetar:  Infrastructure, sanitation, no connection, strandard error target",Brown,
sanitnoconseyrtar,946,11,Infrastructure,Infrastructure: Water and Sanitation,2,Parameter,"sanitnoconseyrtar:  Infrastructure, sanitation, no connection, years to target standard error",Brown,
savingsdiscountrt,948,11,Infrastructure,Infrastructure: Water and Sanitation,2,Parameter,savingsdiscountrt:  Savings discount rate,Brown,
sfmassrep,957,11,Sociopolitical,Sociopolitical: State failure,2,Parameter,"sfmassrep:  State failure switch/multiplier (>0.05=On), internal war repression by govt",drakgray,
